{"case_id":"FDE-TRIAL-001","document_type":"ACTOR_AND_AUTHORITY","payload":{"action_sink":"LOCAL_FAKE_ONLY","engine":"ADVISE_ONLY","human_approver":{"actor_id":"synthetic-refund-policy-owner-001","authority_ref":"synthetic://fde-trial-001/authority/refund-policy-owner/001","expires_at":"2026-12-31T23:59:59Z","issued_at":"2026-09-10T00:00:00Z","policy_id":"refund-policy","policy_version":"2.0-proposed","scope":["APPROVE_POLICY_ACTIVATION","REJECT_POLICY_ACTIVATION","AUTHORIZE_LOCAL_FAKE_ACTION"],"synthetic":true},"knowledge_governance":"PERSIST_AUDIT_REPLAY","observer":"OBSERVE_AND_PROJECT_ONLY"},"schema_version":"0.1.0-rc"}
