{"case_id":"FDE-TRIAL-001","document_type":"POLICY_PROPOSED","payload":{"candidate_snapshot_ref":"synthetic://fde-trial-001/kg/refund-policy/2.0-proposed","parent_snapshot_ref":"synthetic://fde-trial-001/kg/refund-policy/1.0","parent_version":"1.0","policy_id":"refund-policy","proposed_by":"fde-owner-synthetic","risk_scope":["HIGH_VALUE","HIGH_RISK","OPENED_PACKAGE"],"rule":"High-value or high-risk items require human review before any refund action.","source_content_sha256":"BB858027A6ED68B8705B3399E996DE5B1876A4747964D231E228204C13DA26D5","source_digest_scope":"UTF8_BYTES_OF_PAYLOAD_RULE_NO_TERMINATOR","source_ref":"synthetic://fde-trial-001/policy/2.0-proposed","status":"PROPOSED","version":"2.0-proposed"},"schema_version":"0.1.0-rc"}
