{"case_id":"FDE-TRIAL-001","document_type":"POLICY_BEFORE","payload":{"effective_from":"2026-01-01T00:00:00Z","policy_id":"refund-policy","rule":"Delivery-confirmed orders may request automatic refund within 7 days.","snapshot_ref":"synthetic://fde-trial-001/kg/refund-policy/1.0","source_content_sha256":"C303F4EE95048BAAD0D403C00B424D7BE7C3FC96DD2BAF4F1E26698D9F976F39","source_digest_scope":"UTF8_BYTES_OF_PAYLOAD_RULE_NO_TERMINATOR","source_ref":"synthetic://fde-trial-001/policy/1.0","status":"ACTIVE","version":"1.0"},"schema_version":"0.1.0-rc"}
