{"case_id":"FDE-TRIAL-001","document_type":"SNAPSHOT_BINDING","payload":{"engine_commit":"11c6f83593a327457940c6b5832aa03aa50713ee","kg_commit":"869f61bd7bb970a2743058a52fe1e23570667028","knowledge_snapshot_ref":"synthetic://fde-trial-001/kg/refund-policy/2.0-proposed","observer_commit":"98da9559b8076770d9b5471ba0fde2cac4a6fe3c","protocol_schema_version":"fde-trial-001/0.1.0-rc"},"schema_version":"0.1.0-rc"}
